<?xml version="1.0" encoding="UTF-8"?>
<schema xmlns="http://www.w3.org/2001/XMLSchema" targetNamespace="http://www.clicktravel.com/schema/v1/common"
	xmlns:common="http://www.clicktravel.com/schema/v1/common"
	elementFormDefault="qualified">

	<element name="ErrorResponse">
		<complexType>
			<choice>
				<element name="errors" type="common:Error" maxOccurs="unbounded" />
				<element name="validationErrors" type="common:ValidationError"
					maxOccurs="unbounded" />
			</choice>
		</complexType>
	</element>

	<complexType name="Error">
		<sequence>
			<element name="description" type="string" />
		</sequence>
	</complexType>

	<complexType name="ValidationError">
		<sequence>
			<element name="field" type="string" maxOccurs="unbounded"/>
			<element name="error" type="string" />
		</sequence>
	</complexType>
	
</schema>